{
  "overall": "pass",
  "summary": "Refresh token issuance satisfies the contract.",
  "contract_completeness": {
    "status": "complete",
    "missing": []
  },
  "evidence_sufficiency": "sufficient_for_pass",
  "criteria_results": [
    {
      "criterion": "criterion-refresh-issued",
      "status": "pass",
      "severity": "must",
      "evidence": ["ev-tests-auth"],
      "reason": "Auth tests passed and diff includes token issuance."
    }
  ],
  "evidence": [
    {
      "ref": "ev-tests-auth",
      "type": "test_result",
      "summary": "npm test -- auth passed.",
      "supports": ["criterion-refresh-issued"],
      "confidence": "high"
    }
  ],
  "failures": [],
  "plan_gaps": [],
  "environment_issues": [],
  "unsafe_findings": [],
  "allow_unit_complete": true,
  "allow_batch_continue": true,
  "eligible_next_actions": ["pass"],
  "blocked_next_actions": [],
  "residual_risks": []
}
